{
  "$schema": "../../../../../../schema/adapter.schema.json",
  "schemaVersion": 1,
  "target": "opencode",
  "scopes": [
    "project",
    "user"
  ],
  "files": [
    {
      "from": "targets/opencode/research-gap-mapper.md",
      "to": "agents/{slug}.md"
    }
  ],
  "stability": "stable",
  "limitations": []
}
