{
  "$schema": "../../../../../../schema/adapter.schema.json",
  "schemaVersion": 1,
  "target": "codex",
  "scopes": [
    "project"
  ],
  "files": [
    {
      "from": "targets/claude-code/package-publish-guard.mjs",
      "to": "hooks/youdede/package-publish-guard.mjs",
      "executable": true
    }
  ],
  "settingsPatch": {
    "path": "hooks.json",
    "hooks": {
      "PreToolUse": [
        {
          "matcher": "Bash",
          "hooks": [
            {
              "type": "command",
              "command": "node \"{codexRoot}/hooks/youdede/package-publish-guard.mjs\"",
              "timeout": 10,
              "statusMessage": "[youdede:package-publish-guard] Evaluating package publish guard."
            }
          ]
        }
      ]
    }
  },
  "bindings": [
    {
      "event": "PreToolUse",
      "matcher": "Bash"
    }
  ],
  "stability": "stable",
  "limitations": [
    "This native tranche covers shell-command interception only; project hook definitions require Codex trust review before execution."
  ]
}
