{
  "$schema": "../../../../../../schema/adapter.schema.json",
  "schemaVersion": 1,
  "target": "gemini-cli",
  "scopes": [
    "project"
  ],
  "files": [
    {
      "from": "targets/claude-code/outbound-data-guard.mjs",
      "to": "hooks/youdede/outbound-data-guard.core.mjs",
      "executable": true
    },
    {
      "root": "package",
      "from": "scripts/runtime/hook-command-bridge.mjs",
      "to": "hooks/youdede/outbound-data-guard.mjs",
      "executable": true
    }
  ],
  "settingsPatch": {
    "path": "settings.json",
    "hooks": {
      "BeforeTool": [
        {
          "matcher": "run_shell_command",
          "sequential": true,
          "hooks": [
            {
              "name": "youdede-outbound-data-guard",
              "type": "command",
              "command": "node \"{geminiRoot}/hooks/youdede/outbound-data-guard.mjs\" --target gemini-cli --failure-policy fail-closed",
              "timeout": 10000,
              "description": "[youdede:outbound-data-guard] Block explicit local-file uploads and dynamic payloads sent by common network commands."
            }
          ]
        }
      ]
    }
  },
  "bindings": [
    {
      "event": "BeforeTool",
      "matcher": "run_shell_command"
    }
  ],
  "stability": "preview",
  "limitations": [
    "This first native tranche covers shell-command interception only; write, MCP, prompt, and lifecycle boundaries remain withheld pending fixtures."
  ]
}
