{
  "$schema": "../../../../../../schema/adapter.schema.json",
  "schemaVersion": 1,
  "target": "gemini-cli",
  "scopes": [
    "project"
  ],
  "files": [
    {
      "from": "targets/claude-code/firewall-policy-mutation-guard.mjs",
      "to": "hooks/youdede/firewall-policy-mutation-guard.core.mjs",
      "executable": true
    },
    {
      "root": "package",
      "from": "scripts/runtime/hook-command-bridge.mjs",
      "to": "hooks/youdede/firewall-policy-mutation-guard.mjs",
      "executable": true
    }
  ],
  "settingsPatch": {
    "path": "settings.json",
    "hooks": {
      "BeforeTool": [
        {
          "matcher": "run_shell_command",
          "sequential": true,
          "hooks": [
            {
              "name": "youdede-firewall-policy-mutation-guard",
              "type": "command",
              "command": "node \"{geminiRoot}/hooks/youdede/firewall-policy-mutation-guard.mjs\" --target gemini-cli --failure-policy fail-closed",
              "timeout": 10000,
              "description": "[youdede:firewall-policy-mutation-guard] Block direct host firewall rule, policy, chain, and activation mutations."
            }
          ]
        }
      ]
    }
  },
  "bindings": [
    {
      "event": "BeforeTool",
      "matcher": "run_shell_command"
    }
  ],
  "stability": "preview",
  "limitations": [
    "This first native tranche covers shell-command interception only; write, MCP, prompt, and lifecycle boundaries remain withheld pending fixtures.",
    "Google stopped serving Gemini CLI on 2026-06-18 for free use and Google AI Pro and Ultra; it remains available with Gemini Code Assist Standard or Enterprise licenses and paid API keys. Antigravity CLI is not a target of this adapter."
  ]
}
