{
  "$schema": "../../../../../../schema/adapter.schema.json",
  "schemaVersion": 1,
  "target": "cursor",
  "scopes": [
    "project"
  ],
  "files": [
    {
      "from": "targets/claude-code/container-registry-publish-guard.mjs",
      "to": "hooks/youdede/container-registry-publish-guard.core.mjs",
      "executable": true
    },
    {
      "root": "package",
      "from": "scripts/runtime/hook-command-bridge.mjs",
      "to": "hooks/youdede/container-registry-publish-guard.mjs",
      "executable": true
    }
  ],
  "settingsPatch": {
    "path": "hooks.json",
    "hooks": {
      "preToolUse": [
        {
          "type": "command",
          "command": "node \"{cursorRoot}/hooks/youdede/container-registry-publish-guard.mjs\" --target cursor --failure-policy fail-closed --marker \"[youdede:container-registry-publish-guard]\"",
          "timeout": 10,
          "failClosed": true,
          "matcher": "Shell"
        }
      ]
    }
  },
  "bindings": [
    {
      "event": "preToolUse",
      "matcher": "Shell"
    }
  ],
  "stability": "stable",
  "limitations": [
    "This first native tranche covers the documented Shell payload only and does not depend on the optional Claude compatibility loader."
  ]
}
