{"$schema":"../../../../../../schema/adapter.schema.json","schemaVersion":1,"target":"claude-code","scopes":["project"],"files":[{"from":"targets/claude-code/cloud-resource-deletion-guard.mjs","to":"hooks/youdede/cloud-resource-deletion-guard.mjs","executable":true}],"settingsPatch":{"hooks":{"PreToolUse":[{"matcher":"Bash","description":"[youdede:cloud-resource-deletion-guard] Refuse direct cloud deletion","hooks":[{"type":"command","command":"node \"{claudeRoot}/hooks/youdede/cloud-resource-deletion-guard.mjs\"","timeout":10}]}]}}}
