{"$schema":"../../../../../../schema/adapter.schema.json","schemaVersion":1,"target":"claude-code","scopes":["project"],"files":[{"from":"targets/claude-code/system-path-mutation-guard.mjs","to":"hooks/youdede/system-path-mutation-guard.mjs","executable":true}],"settingsPatch":{"hooks":{"PreToolUse":[{"matcher":"Bash","description":"[youdede:system-path-mutation-guard] Refuse protected system path mutation","hooks":[{"type":"command","command":"node \"{claudeRoot}/hooks/youdede/system-path-mutation-guard.mjs\"","timeout":10}]}]}}}
