{
  "$schema": "../../../../../../schema/adapter.schema.json",
  "schemaVersion": 1,
  "target": "gemini-cli",
  "scopes": [
    "project",
    "user"
  ],
  "files": [
    {
      "from": "targets/gemini-cli/research-gap-mapper.md",
      "to": "agents/{slug}.md"
    }
  ],
  "stability": "stable",
  "limitations": [
    "Google stopped serving Gemini CLI on 2026-06-18 for free use and Google AI Pro and Ultra; it remains available with Gemini Code Assist Standard or Enterprise licenses and paid API keys. Antigravity CLI is not a target of this adapter."
  ]
}
